{
  "schema": "opsdevcode.release-classification/v0",
  "organization": "opsdevcode",
  "canonicalChannel": "github-release",
  "policy": "docs/github-releases.md",
  "repos": [
    {
      "contract": {
        "schema": "opsdevcode.release/v0",
        "repository": "opsdevcode/.github",
        "profile": "org-meta",
        "canonical": "none",
        "engine": "none",
        "tagPolicy": {
          "manualTags": false,
          "retag": false
        },
        "prerelease": {
          "githubMakeLatest": false
        },
        "downstream": {
          "pypi": {
            "role": "none"
          },
          "ghcr": {
            "role": "none",
            "latest": false,
            "visibilityChange": false
          },
          "marketplace": {
            "role": "none"
          },
          "openvsx": {
            "role": "none"
          },
          "pages": {
            "role": "none"
          }
        },
        "artifacts": [],
        "provenance": {
          "synthesize": false
        },
        "notes": "Org policy and schema owner. No product GitHub Release."
      },
      "enforcementState": "adopted",
      "coverage": "none"
    },
    {
      "contract": {
        "schema": "opsdevcode.release/v0",
        "repository": "opsdevcode/specmint-language",
        "profile": "mint-language",
        "canonical": "github-release",
        "engine": "release-please",
        "tagPolicy": {
          "manualTags": false,
          "retag": false,
          "pattern": "^v0\\.[0-9]+\\.[0-9]+-alpha\\.[0-9]+$"
        },
        "prerelease": {
          "githubMakeLatest": false
        },
        "downstream": {
          "pypi": {
            "role": "mirror"
          },
          "ghcr": {
            "role": "none",
            "latest": false,
            "visibilityChange": false
          },
          "marketplace": {
            "role": "deferred"
          },
          "openvsx": {
            "role": "deferred"
          },
          "pages": {
            "role": "mirror"
          }
        },
        "artifacts": [
          "wheel",
          "sdist",
          "vsix",
          "sha256sums",
          "sbom"
        ],
        "provenance": {
          "synthesize": false
        },
        "notes": "PyPI is a mirror of GitHub Release bytes. Marketplace/Open VSX deferred. Pages mirror is GitHub Pages on this repo; intended custom domain mint.opsdevco.de after owner DNS. Not a second compiler or analytics stack."
      },
      "enforcementState": "pending",
      "coverage": "complete",
      "historicalGaps": [
        {
          "tag": "v1.0.0-alpha.1",
          "status": "accidental-1x",
          "action": "leave-in-place"
        }
      ]
    },
    {
      "contract": {
        "schema": "opsdevcode.release/v0",
        "repository": "opsdevcode/specmint-platform",
        "profile": "mint-platform",
        "canonical": "github-release",
        "engine": "release-please",
        "tagPolicy": {
          "manualTags": false,
          "retag": false,
          "pattern": "^v0\\.[0-9]+\\.[0-9]+-alpha\\.[0-9]+$"
        },
        "prerelease": {
          "githubMakeLatest": false
        },
        "downstream": {
          "pypi": {
            "role": "none"
          },
          "ghcr": {
            "role": "mirror",
            "latest": false,
            "visibilityChange": false
          },
          "marketplace": {
            "role": "deferred"
          },
          "openvsx": {
            "role": "deferred"
          },
          "pages": {
            "role": "none"
          }
        },
        "artifacts": [
          "wheel",
          "sdist",
          "sha256sums",
          "sbom",
          "image"
        ],
        "provenance": {
          "synthesize": false
        },
        "notes": "GHCR is a mirror; package visibility is unchanged by this program."
      },
      "enforcementState": "pending",
      "coverage": "complete",
      "historicalGaps": [
        {
          "tag": "v1.0.0-alpha.1",
          "status": "accidental-1x",
          "action": "leave-in-place"
        }
      ]
    },
    {
      "contract": {
        "schema": "opsdevcode.release/v0",
        "repository": "opsdevcode/mint-integration-template",
        "profile": "mint-integration",
        "canonical": "github-release",
        "engine": "release-please",
        "tagPolicy": {
          "manualTags": false,
          "retag": false,
          "pattern": "^v0\\.[0-9]+\\.[0-9]+-alpha\\.[0-9]+$"
        },
        "prerelease": {
          "githubMakeLatest": false
        },
        "downstream": {
          "pypi": {
            "role": "deferred"
          },
          "ghcr": {
            "role": "none",
            "latest": false,
            "visibilityChange": false
          },
          "marketplace": {
            "role": "deferred"
          },
          "openvsx": {
            "role": "deferred"
          },
          "pages": {
            "role": "none"
          }
        },
        "artifacts": [
          "notes"
        ],
        "provenance": {
          "synthesize": false
        },
        "notes": "Template repo. Integration PyPI deferred."
      },
      "enforcementState": "pending",
      "coverage": "complete"
    },
    {
      "contract": {
        "schema": "opsdevcode.release/v0",
        "repository": "opsdevcode/mint-integration-local",
        "profile": "mint-integration",
        "canonical": "github-release",
        "engine": "release-please",
        "tagPolicy": {
          "manualTags": false,
          "retag": false,
          "pattern": "^v0\\.[0-9]+\\.[0-9]+-alpha\\.[0-9]+$"
        },
        "prerelease": {
          "githubMakeLatest": false
        },
        "downstream": {
          "pypi": {
            "role": "deferred"
          },
          "ghcr": {
            "role": "none",
            "latest": false,
            "visibilityChange": false
          },
          "marketplace": {
            "role": "deferred"
          },
          "openvsx": {
            "role": "deferred"
          },
          "pages": {
            "role": "none"
          }
        },
        "artifacts": [
          "wheel",
          "sdist",
          "sha256sums",
          "sbom"
        ],
        "provenance": {
          "synthesize": false
        },
        "notes": "GitHub Release is canonical. PyPI trusted publisher deferred."
      },
      "enforcementState": "pending",
      "coverage": "complete"
    },
    {
      "contract": {
        "schema": "opsdevcode.release/v0",
        "repository": "opsdevcode/mint-integration-github",
        "profile": "mint-integration",
        "canonical": "github-release",
        "engine": "release-please",
        "tagPolicy": {
          "manualTags": false,
          "retag": false,
          "pattern": "^v0\\.[0-9]+\\.[0-9]+-alpha\\.[0-9]+$"
        },
        "prerelease": {
          "githubMakeLatest": false
        },
        "downstream": {
          "pypi": {
            "role": "deferred"
          },
          "ghcr": {
            "role": "none",
            "latest": false,
            "visibilityChange": false
          },
          "marketplace": {
            "role": "deferred"
          },
          "openvsx": {
            "role": "deferred"
          },
          "pages": {
            "role": "none"
          }
        },
        "artifacts": [
          "wheel",
          "sdist",
          "sha256sums",
          "sbom"
        ],
        "provenance": {
          "synthesize": false
        },
        "notes": "GitHub Release is canonical. PyPI trusted publisher deferred."
      },
      "enforcementState": "pending",
      "coverage": "complete"
    },
    {
      "contract": {
        "schema": "opsdevcode.release/v0",
        "repository": "opsdevcode/mint-action",
        "profile": "product",
        "canonical": "github-release",
        "engine": "release-please",
        "tagPolicy": {
          "manualTags": false,
          "retag": false,
          "pattern": "^v0\\.[0-9]+\\.[0-9]+-alpha\\.[0-9]+$"
        },
        "prerelease": {
          "githubMakeLatest": false
        },
        "downstream": {
          "pypi": {
            "role": "none"
          },
          "ghcr": {
            "role": "none",
            "latest": false,
            "visibilityChange": false
          },
          "marketplace": {
            "role": "none"
          },
          "openvsx": {
            "role": "none"
          },
          "pages": {
            "role": "none"
          }
        },
        "artifacts": [
          "notes"
        ],
        "provenance": {
          "synthesize": false
        },
        "notes": "Release Please owns tags after squash-merge. Consumers still pin an immutable merge SHA, never @main, @latest, or a floating v1. Language wheel comes from the specmint-language GitHub Release. githubMakeLatest stays false."
      },
      "enforcementState": "pending",
      "coverage": "notes"
    },
    {
      "contract": {
        "schema": "opsdevcode.release/v0",
        "repository": "opsdevcode/mint-registry",
        "profile": "mint-registry",
        "canonical": "github-release",
        "engine": "release-please",
        "tagPolicy": {
          "manualTags": false,
          "retag": false,
          "pattern": "^v0\\.[0-9]+\\.[0-9]+-alpha\\.[0-9]+$"
        },
        "prerelease": {
          "githubMakeLatest": false
        },
        "downstream": {
          "pypi": {
            "role": "none"
          },
          "ghcr": {
            "role": "none",
            "latest": false,
            "visibilityChange": false
          },
          "marketplace": {
            "role": "none"
          },
          "openvsx": {
            "role": "none"
          },
          "pages": {
            "role": "none"
          }
        },
        "artifacts": [
          "notes",